{
  "candidate": {
    "authn": {
      "proof_digest": "sha256:47bc971d307560ae2196e1ce9ab36e063d23e05e8a9bfc79e99172bcf16eb892",
      "signer_principal_id": "principal:responsible"
    },
    "causal_parents": [
      "tx:241bd82aac02628039ad516bec3943b883df83c631739f48c2c9f6b54d7b74d0"
    ],
    "constitution_epoch": 0,
    "context_id": "ctx:18b62079f21b9557a8535e808d24b1a9df69737f45a14d20b3d4bb1546c64922",
    "expected_local_ordinal": 1,
    "kind": "MEMBER_CONTEXT_GENESIS",
    "parent_state_root": "sha256:1309809e0f9f2a896a83f9f4fc919b9b95322f00490a059569686dfe2a100f01",
    "payload": {
      "context_genesis_nonce": "h2",
      "context_kind": "SUBJECT",
      "depends_on_context_ids": [],
      "initial_authorities": [],
      "local_alias": "h2",
      "member_principal_id": "principal:delegate",
      "parent_context_id": "ctx:18b62079f21b9557a8535e808d24b1a9df69737f45a14d20b3d4bb1546c64922"
    },
    "schema_version": "0.1-rc11",
    "transition_id": "tx:7cd4ced478ad55f1c79c663f7af8856943f8c49a9a03e73654277ad90c8a2126",
    "trust_space_id": "ts:1609bab738b98092e3d8032e7e55fc2e52a56700bce2abb266c83fbdde1e5878"
  },
  "case_id": "POS-002",
  "description": "Parent capability creates a child subject namespace.",
  "expected": {
    "accepted": true,
    "code": "ACCEPTED",
    "state_changed": true
  },
  "initial_genesis": {
    "bootstrap_policy": {
      "allowed_context_kinds": [
        "FEDERATION"
      ],
      "allowed_initial_capabilities": [
        "CREATE_MEMBER_CONTEXT",
        "ISSUE_PERMIT",
        "VERIFY",
        "CONFIRM_OUTCOME",
        "EXPORT",
        "IMPORT",
        "SUSPEND_GUARANTEE",
        "RECONCILE",
        "REDEFINE_CONTEXT",
        "TERMINATE_CONTEXT",
        "TRANSFER_AUTHORITY"
      ],
      "max_admissions": 1,
      "validator_principal_id": "principal:bootstrap"
    },
    "constitution": {
      "accepted_coordination_proofs": [
        "sha256:a4ce6f8a8a3ea88cbc11a2b96ef662e83ca21e5c84109644b962e4236b2ef478"
      ],
      "accepted_patches": [],
      "constitution_id": "constitution:root",
      "coordination_classes": {
        "APPEND_EVIDENCE": "MONOTONE_LOCAL",
        "APPEND_OBSERVATION": "MONOTONE_LOCAL",
        "AUTHORITY_CHANGE": "COORDINATION_REQUIRED",
        "CONTEXT_REDEFINE": "COORDINATION_REQUIRED",
        "SAFE_COUNTER": "INVARIANT_CONFLUENT"
      },
      "identity_immunities": [
        "/seed_semantics_id",
        "/trust_space_id",
        "/root_context_id",
        "/contexts/*/genesis_digest",
        "/contexts/*/parent_context_id"
      ],
      "policy_version": 1,
      "rules": {
        "rule:bootstrap": "sha256:5219664ad4a9acbf0b7a143ca79ce141f5e87fdb8752efb740163f89c2b9a2ca",
        "rule:permit": "sha256:4143c4f029ca389a681115121da329498ac2278ae1a3663976a23fcebe486ef4",
        "rule:verification": "sha256:cc75134587dcd7fa8aa4d1e55a355e8643d61136a3d58fee8d4c57b23a9440e3"
      }
    },
    "expected_constitution_digest": "sha256:f43d179174218db9e891925e96c22f349993f8ace8c169e1f7d3404dc42e9674",
    "expected_root_context_id": "ctx:6c94166c411b9579e2d06af3157708d3bdc1cc4d4179bad7cfb4c79dc878b441",
    "expected_root_genesis_digest": "sha256:5584c7d80898c97627e6100b1f6bc7bcf23c90f373d722b1fc46f5fe03bad79a",
    "expected_trust_space_id": "ts:1609bab738b98092e3d8032e7e55fc2e52a56700bce2abb266c83fbdde1e5878",
    "external_anchor_digest": "sha256:57da8a3caad7a8de81074ec503dc647ef56e4510d1f2deddb0e2ffda8735392d",
    "root_context_nonce": "root-nonce-001",
    "schema_version": "0.1-rc11",
    "seed_semantics_id": "aset-seed:0.1-rc11"
  },
  "postconditions": [],
  "setup": [
    {
      "authn": {
        "proof_digest": "sha256:e3cff0abcfb4ea1d04a2ba1717cd1c747c4c39bff191129dc82c50aafbdb7358",
        "signer_principal_id": "principal:bootstrap"
      },
      "causal_parents": [],
      "constitution_epoch": 0,
      "context_id": "ctx:6c94166c411b9579e2d06af3157708d3bdc1cc4d4179bad7cfb4c79dc878b441",
      "expected_local_ordinal": 1,
      "kind": "MEMBER_CONTEXT_GENESIS",
      "parent_state_root": "sha256:fc65383cffe7f067c6fd1ea829653b86c7449fb279da12d12151670272ad9bb9",
      "payload": {
        "context_genesis_nonce": "f-nonce",
        "context_kind": "FEDERATION",
        "depends_on_context_ids": [],
        "initial_authorities": [
          {
            "capability_kind": "CREATE_MEMBER_CONTEXT",
            "holder_principal_id": "principal:responsible",
            "scope": [
              "*"
            ]
          },
          {
            "capability_kind": "ISSUE_PERMIT",
            "holder_principal_id": "principal:responsible",
            "scope": [
              "*"
            ]
          },
          {
            "capability_kind": "VERIFY",
            "holder_principal_id": "principal:validator",
            "scope": [
              "*"
            ]
          },
          {
            "capability_kind": "CONFIRM_OUTCOME",
            "holder_principal_id": "principal:responsible",
            "scope": [
              "*"
            ]
          },
          {
            "capability_kind": "EXPORT",
            "holder_principal_id": "principal:responsible",
            "scope": [
              "*"
            ]
          },
          {
            "capability_kind": "IMPORT",
            "holder_principal_id": "principal:responsible",
            "scope": [
              "*"
            ]
          },
          {
            "capability_kind": "SUSPEND_GUARANTEE",
            "holder_principal_id": "principal:responsible",
            "scope": [
              "*"
            ]
          },
          {
            "capability_kind": "RECONCILE",
            "holder_principal_id": "principal:responsible",
            "scope": [
              "*"
            ]
          },
          {
            "capability_kind": "REDEFINE_CONTEXT",
            "holder_principal_id": "principal:responsible",
            "scope": [
              "*"
            ]
          },
          {
            "capability_kind": "TERMINATE_CONTEXT",
            "holder_principal_id": "principal:responsible",
            "scope": [
              "*"
            ]
          },
          {
            "capability_kind": "TRANSFER_AUTHORITY",
            "holder_principal_id": "principal:responsible",
            "scope": [
              "*"
            ]
          }
        ],
        "local_alias": "f",
        "member_principal_id": "principal:responsible",
        "parent_context_id": "ctx:6c94166c411b9579e2d06af3157708d3bdc1cc4d4179bad7cfb4c79dc878b441"
      },
      "schema_version": "0.1-rc11",
      "transition_id": "tx:241bd82aac02628039ad516bec3943b883df83c631739f48c2c9f6b54d7b74d0",
      "trust_space_id": "ts:1609bab738b98092e3d8032e7e55fc2e52a56700bce2abb266c83fbdde1e5878"
    }
  ]
}
