{
  "candidate": {
    "authn": {
      "proof_digest": "sha256:dddddddddddddddddddddddddddddddddddddddddddddddddddddddddddddddd",
      "signer_principal_id": "principal:admin"
    },
    "causal_parents": [
      "tx:244542e09dbb20cdb3436694c05f3f7e48af7f32323d783bf36777a187e62722",
      "tx:a3a01f9e2f25c8592f46aae3930d2bad8d702b742c6dfb4f8c98424bcf258692",
      "tx:e9aa2203f1ed76586936d60516e876dee09cd808185775abf4c2807caf063287"
    ],
    "constitution_epoch": 0,
    "context_id": "ctx:c064d3036c01331954aebb3df469865716f1b0489017274b191429ca8522dc12",
    "expected_local_ordinal": 3,
    "kind": "CONTEXT_REDEFINE",
    "parent_state_root": "sha256:a1b4e5c805618d219b0bc1e647442be18431f26bfa45b77158b21cc6d3d4c8df",
    "payload": {
      "proposal": {
        "parent_context_id": "ctx:c064d3036c01331954aebb3df469865716f1b0489017274b191429ca8522dc12",
        "proposal_nonce": "proposal-1",
        "replacements": [
          {
            "context_genesis_nonce": "a-v2",
            "depends_on_context_ids": [],
            "initial_authorities": [],
            "old_context_id": "ctx:6baa15209b1021babbc06b9fccc5158fde091a5c6e772aff0c242bc592101239"
          },
          {
            "context_genesis_nonce": "b-v2",
            "depends_on_context_ids": [
              "ctx:6baa15209b1021babbc06b9fccc5158fde091a5c6e772aff0c242bc592101239"
            ],
            "initial_authorities": [],
            "old_context_id": "ctx:e56499a44e151e791d3010ab80b12fa202588dcb4f3ddf260b1c943f2e43ba10"
          }
        ],
        "target_context_id": "ctx:6baa15209b1021babbc06b9fccc5158fde091a5c6e772aff0c242bc592101239"
      },
      "proposal_digest": "sha256:f6ca9b016d1f28de756553c07c0a0fa8626ec12d290329bf0e40e1e44b062b7b",
      "withdrawal_authorizations": [
        {
          "context_id": "ctx:6baa15209b1021babbc06b9fccc5158fde091a5c6e772aff0c242bc592101239",
          "member_principal_id": "principal:a",
          "proof_digest": "sha256:eeeeeeeeeeeeeeeeeeeeeeeeeeeeeeeeeeeeeeeeeeeeeeeeeeeeeeeeeeeeeeee",
          "proposal_digest": "sha256:f6ca9b016d1f28de756553c07c0a0fa8626ec12d290329bf0e40e1e44b062b7b"
        },
        {
          "context_id": "ctx:e56499a44e151e791d3010ab80b12fa202588dcb4f3ddf260b1c943f2e43ba10",
          "member_principal_id": "principal:b",
          "proof_digest": "sha256:ffffffffffffffffffffffffffffffffffffffffffffffffffffffffffffffff",
          "proposal_digest": "sha256:f6ca9b016d1f28de756553c07c0a0fa8626ec12d290329bf0e40e1e44b062b7b"
        }
      ]
    },
    "schema_version": "0.1-rc11",
    "transition_id": "tx:c99e7c3eeac82d7100c996e1fd331d6563b7199096895dacb6919e05af0d488e",
    "trust_space_id": "ts:20da7646d242507e930d54f300b3ea2a33ee39a4a78cf3470107fc09ab7d0677"
  },
  "case_id": "POS-017",
  "description": "Atomic redefinition consumes exact member-signed withdrawal authorizations for the complete affected sibling set.",
  "expected": {
    "accepted": true,
    "code": "ACCEPTED",
    "state_changed": true
  },
  "initial_genesis": {
    "bootstrap_policy": {
      "allowed_context_kinds": [
        "FEDERATION"
      ],
      "allowed_initial_capabilities": [
        "CREATE_MEMBER_CONTEXT",
        "REDEFINE_CONTEXT",
        "TERMINATE_CONTEXT"
      ],
      "max_admissions": 1,
      "validator_principal_id": "principal:bootstrap"
    },
    "constitution": {
      "accepted_coordination_proofs": [],
      "accepted_patches": [],
      "constitution_id": "constitution:root",
      "coordination_classes": {
        "CONTEXT_REDEFINE": "COORDINATION_REQUIRED"
      },
      "identity_immunities": [
        "/seed_semantics_id",
        "/trust_space_id",
        "/root_context_id",
        "/contexts/*/genesis_digest",
        "/contexts/*/parent_context_id"
      ],
      "policy_version": 1,
      "rules": {
        "rule:permit": "sha256:cccccccccccccccccccccccccccccccccccccccccccccccccccccccccccccccc",
        "rule:verification": "sha256:bbbbbbbbbbbbbbbbbbbbbbbbbbbbbbbbbbbbbbbbbbbbbbbbbbbbbbbbbbbbbbbb"
      }
    },
    "expected_constitution_digest": "sha256:3db1b776c63d82fd8c27e9ea8d88a25b5df16c1eff15697158a7686d8e696a78",
    "expected_root_context_id": "ctx:22c63434383dfb3475798a2b797ae0d64246af0642287d82c20f635d307a4dff",
    "expected_root_genesis_digest": "sha256:613c6e931b7a22de009bd704198b9282960fa5d242268c492eff40408c4ebd39",
    "expected_trust_space_id": "ts:20da7646d242507e930d54f300b3ea2a33ee39a4a78cf3470107fc09ab7d0677",
    "external_anchor_digest": "sha256:aaaaaaaaaaaaaaaaaaaaaaaaaaaaaaaaaaaaaaaaaaaaaaaaaaaaaaaaaaaaaaaa",
    "root_context_nonce": "root-rc11-governance",
    "schema_version": "0.1-rc11",
    "seed_semantics_id": "aset-seed:0.1-rc11"
  },
  "postconditions": [],
  "setup": [
    {
      "authn": {
        "proof_digest": "sha256:dddddddddddddddddddddddddddddddddddddddddddddddddddddddddddddddd",
        "signer_principal_id": "principal:bootstrap"
      },
      "causal_parents": [],
      "constitution_epoch": 0,
      "context_id": "ctx:22c63434383dfb3475798a2b797ae0d64246af0642287d82c20f635d307a4dff",
      "expected_local_ordinal": 1,
      "kind": "MEMBER_CONTEXT_GENESIS",
      "parent_state_root": "sha256:5227d0e0d3d92f7a99d440b6e1496a439399830d687bbdb38c41efcfb82d0287",
      "payload": {
        "context_genesis_nonce": "f-v1",
        "context_kind": "FEDERATION",
        "depends_on_context_ids": [],
        "initial_authorities": [
          {
            "capability_kind": "CREATE_MEMBER_CONTEXT",
            "holder_principal_id": "principal:admin",
            "scope": [
              "*"
            ]
          },
          {
            "capability_kind": "REDEFINE_CONTEXT",
            "holder_principal_id": "principal:admin",
            "scope": [
              "*"
            ]
          }
        ],
        "local_alias": "f",
        "member_principal_id": "principal:admin",
        "parent_context_id": "ctx:22c63434383dfb3475798a2b797ae0d64246af0642287d82c20f635d307a4dff"
      },
      "schema_version": "0.1-rc11",
      "transition_id": "tx:a3a01f9e2f25c8592f46aae3930d2bad8d702b742c6dfb4f8c98424bcf258692",
      "trust_space_id": "ts:20da7646d242507e930d54f300b3ea2a33ee39a4a78cf3470107fc09ab7d0677"
    },
    {
      "authn": {
        "proof_digest": "sha256:dddddddddddddddddddddddddddddddddddddddddddddddddddddddddddddddd",
        "signer_principal_id": "principal:admin"
      },
      "causal_parents": [
        "tx:a3a01f9e2f25c8592f46aae3930d2bad8d702b742c6dfb4f8c98424bcf258692"
      ],
      "constitution_epoch": 0,
      "context_id": "ctx:c064d3036c01331954aebb3df469865716f1b0489017274b191429ca8522dc12",
      "expected_local_ordinal": 1,
      "kind": "MEMBER_CONTEXT_GENESIS",
      "parent_state_root": "sha256:21c6e4fe27232ea2b1e905d0a163680f04c4b40073effdc222d4531ab91e2c41",
      "payload": {
        "context_genesis_nonce": "a-v1",
        "context_kind": "SUBJECT",
        "depends_on_context_ids": [],
        "initial_authorities": [],
        "local_alias": "a",
        "member_principal_id": "principal:a",
        "parent_context_id": "ctx:c064d3036c01331954aebb3df469865716f1b0489017274b191429ca8522dc12"
      },
      "schema_version": "0.1-rc11",
      "transition_id": "tx:244542e09dbb20cdb3436694c05f3f7e48af7f32323d783bf36777a187e62722",
      "trust_space_id": "ts:20da7646d242507e930d54f300b3ea2a33ee39a4a78cf3470107fc09ab7d0677"
    },
    {
      "authn": {
        "proof_digest": "sha256:dddddddddddddddddddddddddddddddddddddddddddddddddddddddddddddddd",
        "signer_principal_id": "principal:admin"
      },
      "causal_parents": [
        "tx:a3a01f9e2f25c8592f46aae3930d2bad8d702b742c6dfb4f8c98424bcf258692"
      ],
      "constitution_epoch": 0,
      "context_id": "ctx:c064d3036c01331954aebb3df469865716f1b0489017274b191429ca8522dc12",
      "expected_local_ordinal": 2,
      "kind": "MEMBER_CONTEXT_GENESIS",
      "parent_state_root": "sha256:3f19fb9516c89f0d666142eb89ed355a11e488ea6f09c78c274f9134fbae2484",
      "payload": {
        "context_genesis_nonce": "b-v1",
        "context_kind": "SUBJECT",
        "depends_on_context_ids": [
          "ctx:6baa15209b1021babbc06b9fccc5158fde091a5c6e772aff0c242bc592101239"
        ],
        "initial_authorities": [],
        "local_alias": "b",
        "member_principal_id": "principal:b",
        "parent_context_id": "ctx:c064d3036c01331954aebb3df469865716f1b0489017274b191429ca8522dc12"
      },
      "schema_version": "0.1-rc11",
      "transition_id": "tx:e9aa2203f1ed76586936d60516e876dee09cd808185775abf4c2807caf063287",
      "trust_space_id": "ts:20da7646d242507e930d54f300b3ea2a33ee39a4a78cf3470107fc09ab7d0677"
    }
  ]
}
